Date,Name,Start,End,Tag,WorkingOn
11.09.2025,jon-tj,12:15,15:15,Design Document,Setting up workflows and design specs

25.03.2026,vaakir,12:15,14:00,Planning,Planning filestructure etc
26.03.2026,vaakir,08:15,12:00,Education & recap,React tutorial tictactoe (https://react.dev/learn/tutorial-tic-tac-toe#setup-for-the-tutorial)


25.03.2026,togun,17:42,20:00, Planning, understanding project, looking at data structure
26.03.2026,togun,9:40,18:00, Implementation, basic implementation of the baseline system and then just seeing how things work 